{
  "contract_id": "signguy-pricing-profile-v1",
  "profile_id": "sgpp_v1_sample_profile",
  "created_at_utc": "2026-08-26T12:00:00Z",
  "source_application": "price-lab",
  "manifest": {
    "schema_version": 1,
    "profile_version": "2026.08.sample",
    "engine_version": "0.1.0",
    "currency": "USD",
    "entry_count": 2,
    "excludes": [
      "customers",
      "estimates",
      "orders",
      "invoices",
      "payments",
      "credentials",
      "license data",
      "private URLs",
      "product-specific UI state",
      "raw SQLite files"
    ]
  },
  "shop_settings": {
    "shop_rate": {
      "stable_key": "shop.rate.hourly",
      "unit": "hour",
      "value_kind": "money_cents",
      "value": 8500,
      "source_class": "shop",
      "provenance": {
        "source_label": "Owner confirmed shop rate",
        "rationale": "Approved in Price Lab settings"
      }
    },
    "labor": [],
    "overhead": [],
    "equipment": []
  },
  "pricing_entries": [
    {
      "stable_key": "material.banner_13oz.cost",
      "record_type": "material",
      "pricing_category": "banners",
      "unit": "square_foot",
      "value_kind": "money_cents",
      "value": 19,
      "source_class": "starter",
      "review_state": "accepted",
      "provenance": {
        "source_label": "Starter guidance",
        "pack_type": "starter",
        "pack_version": "starter-sample-v1",
        "accepted_at_utc": "2026-08-26T12:00:00Z"
      }
    },
    {
      "stable_key": "material.banner_13oz.cost",
      "record_type": "material",
      "pricing_category": "banners",
      "unit": "square_foot",
      "value_kind": "money_cents",
      "value": 23,
      "source_class": "shop",
      "review_state": "shop_confirmed",
      "provenance": {
        "source_label": "Shop override",
        "rationale": "Local supplier price"
      }
    }
  ]
}
